ID,Pregunta_Hibrida,Respuesta,Video
43109,"Saber el stock de un articulo a una fecha determinada (consultar stock de articulo, verificar stock de articulo)","1. Ingrese en el menu: [Informes\Historico de Articulos]. 2. Filtrar por el rango de fecha deseado, luego identifique el producto y el deposito a verificar el historico de stock. 3. Haga clic en el boton {Procesar}. 4. Luego haga clic en el boton {Imprimir}.",
40911,"Hacer / utilizar apertura y cierre de Caja (abrir caja, cerrar caja)","1. Ingrese en {Caja}. 2. Haga click en el botón [Apert. y Cierre]. 3. Haga click en el botón [Nuevo]. 4. Si le salta un mensaje de Confirmación para utilizar Apertura y Cierre de Caja, haga click en el botón [Si], sino, omita el paso. 5. Inserte la Fecha, Seleccione el Cajero que está abriendo la Caja y Seleccione la Caja que va a abrir. 6. Luego coloque desde que día y que hora, hasta que día y que hora quedará abierta esa Caja. 7. Haga click en el botón [Guardar]. 8. Seleccione la apertura que desea cerrar y haga click en el botón [Guardar]. Link de Video en Youtube: https://www.youtube.com/watch?v=HWaUqOTB_Tw",
42966,"Configurar monto total de cada moneda o registrar por cantidad de cada producto (moneda, producto, cantidad, monto)","1 - Elija si desea cargar el monto total de Cada moneda o si desea registrar por cantidad de cada producto. 2 - Vaya hasta el campo [Canti], y allí cargue la cantidad. 3 - Ejemplo: Efectivo Gs / Valor = 1 / Canti = 500.000 / Monto = 500.000. 4 - Efectivo Gs 100.000 / Valor = 100.000 / Canti = 5 / Monto = 500.000. 5 - Por último haga click en el botón [Guardar].",
43103,"Configurar vendedores para que utilicen solo algunos canales (vendedores, canales, configuración)","1 - Ingrese en el menú {Utilidades/ Configuraciones/ Canal de Venta.25 }. 2 - Haga click en el botón [Nuevo]. 3 - Ingrese en la grilla habilitada, el código del Vendedor, luego el código del Canal para relacionarlos. 4 - Haga click en el botón [Actualizar]. 5 - Luego, para establecer que el canal solo sea utilizado por los vendedores habilitados o establecidos. 6 - Ingrese en el menú {Tablas/ Registrar Canal }.",
43141,"Configurar canal de venta para vendedores específicos (vendedores, canales, configuración)","1 - Ingrese en el menú {Utilidades/ Configuraciones/ Canal de Venta.25 }. 2 - Haga click en el botón [Nuevo]. 3 - Ingrese en la grilla habilitada, el código del Vendedor, luego el código del Canal para relacionarlos. 4 - Haga click en el botón [Actualizar]. 5 - Luego, para establecer que el canal solo sea utilizado por los vendedores habilitados o establecidos.",
43220,"Configurar para que se solicite vendedor cada vez que se carguen artículos o pedidos en una mesa (vendedores, configuración, solicitar)",1 - Ingrese en el menú {Utilidades/ Configuraciones/ Ventas x Comanda.31}. 2 - Active la opción haciendo clik en [ ] Solicita vendedor cada vez que carga una comanda. 3 - Haga clic en el boton [Actualizar].,
43226,"Colocar seña para procesar venta en Venta x comanda (seña, venta, comanda)","1 - Ingrese en el menú {Utilidades/ Configuraciones/ Ventas x Comanda.31}. 2 - Haga click en el botón [Seña para procesar Venta x comanda]. 3 - Ingrese la seña y presione ENTER, vuelva a repetir la seña y presione ENTER.",
43430,"Eliminar nota de crédito que tiene un cliente a su favor (nota de crédito, cliente, eliminar)",1 - Ingrese al menú {Movimientos/ Nota de Crédito/ Registrar Nota de Crédito}. 2 - Utilize el Filtro de Cliente en la parte de abajo para buscar la nota de crédito emitida al cliente y haga click en el botón [Filtrar]. 3 - Seleccione la nota de crédito que desea eliminar haciendo click sobre él. 4 - Haga clck en el botón [Eliminar]. 5 - Confirme la acción y haga clik en el botón [Aceptar].,
43474,"Crear cuenta o arancel para cobrar directo en cobranza sin tener una deuda previa (cuenta, arancel, cobranza)",1 - Ingrese en el menú {Tablas / Registrar Arancel}. 2 - Ingrese la descripcion y el monto del arancel. 3 - Marque la opcion Cobra Directo (sin necesidad de tener deuda).,
43481,"Proteger nombre del Cliente (seguridad, privacidad, autorización)","1. Ingrese en la opcion el Menu: [Utilidades/ Configuraciones] 2. Haga clic en la pestaña (Cliente), luego clic en el boton {Seña para Modificar nombre del Cliente}, establezca una contraseña para que solo con esa contraseña se pueda modificar el nombre del cliente. 3. Si no desea activar esta funcionalidad no coloque ninguna contraseña.",
43336,"Ver informe de cuentas/saldos/deudas pendientes de mis clientes (informe, cuenta, saldo)","1 - Ingrese desde el menú en {Movimientos/ Informe de Cuentas}. 2 - Seleccione el rango de fecha de vencimiento, si desea ver todas las cuentas, deje vacío el filtro de arriba y el de abajo deje con fecha de hoy o coloque una fecha posterior a hoy. Pestaña Cuentas/Deudas. 3 - Tambien puede usar el filtro de Cliente si desea solo ver de un cliente. 5 - Luego haga clic en el botón [Procesar]. 6 - Y luego haga clic en el boton [Informe detallado por cliente] o [Informe Agrupado por cliente], dependiendo de la necesidad, puede utilizar cualquiera de los informes.",
43684,"Anular o eliminar deuda de un alumno (anular, eliminar, borrar, cancelar)",No se proporcionan pasos específicos en el texto para esta pregunta.,
43294,No se proporciona una pregunta clara en el texto para esta ID,"4 - Luego elija el Informe que vaya acuerdo a su necesidad habilitado en la parte de abajo haciendo click en uno de los botones. Ej: [Detallado por Alumno], [Resumido por Cobranza].",
43482,"Seleccionar o elegir una o varias cuentas en la cobranza (seleccionar, elegir, cuenta, cobranza)","1 - Haga click sobre la cuenta que desea cobrar y presione en el teclado la tecla ESPACIO, con ella se selecciona la tecla. 2 - De la misma manera, si desea seleccionar varias cuentas, vaya haciendo click sobre cada una de ellas y presione la Tecla ESPACIO para seleccionar las que desea cobrar.",
45175,"control de fecha (gestión de fechas, control de vencimiento, administración de plazos)","1 - Ingrese desde el menú en {Inscripcion}. de vencimiento de cuenta [ ], coloque los días hábiles de vencimiento, posterior a la fecha actual, donde permita colocar una fecha vencimiento hasta esa fecha, Ejemplo: si coloca 1825, solo le va a permitir cargar una fecha posterior de hasta 5 años después de la fecha actual. 2 - Presione en el Teclado la tecla F12 o haga click en el campo {Alumno:}, coloque el nombre del alumno que desea buscar y presione ENTER. 3 - Le traerá todas las incripciones correspondientes de ese Alumno. 4 - Seleccione la inscripción correspondiente a la deuda que desea eliminar haciendo click sobre él. 5 - Luego del lado derecho donde está las deudas con su aranceles, seleccione la deuda que desea Eliminar haciendo click sobre él. 6 - Por último, haga click en el botón [Eliminar] que está abajo con letras de color rojo y Listo.",
44230,"¿Cómo configurar para que no permita registrar una venta sin items de articulos? (configuración de venta, restricciones de venta, gestión de artículos)","1- Ingrese al menú {Utilidades/ Configuraciones/ Venta 2.07} 2- Desmarque la opción ""Permite Vender sin item de articulo"" 3- Presione el botón [Actualizar]",
45679,"¿Cómo imprimir orden de Pago? (impresión de orden de pago, gestión de pagos, administración de deudas)","1 - Ingrese en el menú {Compras/ Gestión de Planilla de Pago/ Planilla de Orden de Pago.} 2 - Haga click en el botón [Nuevo]. 3 - Inserte la fecha DESDE que fecha HASTA que fecha desea obtener las deudas a vencer, si desea traer todas las pendientes, coloque en el campo DESDE, una fecha lejana a la fecha actual. 4 - Se debe de posicionar sobre la Columna SALDO, identifique las deudas que desea imprimir su Orden de Pago y seleccione con presionando en el teclado la tecla ESPACIO. 5 - Luego de seleccionar la / las cuentas que desea imprimir, haga click en [Guardar]. 6 - Por último, haga click en el botón [Imp Orden].",
44305,"¿Cómo se cambia los datos de soporte de Atencion al Cliente? (cambio de datos de soporte, actualización de información, gestión de atención al cliente)",1. Ingrese en el menu: [Utilidades\Configuraciones]. 2. Haga clic en la pestaña Avanzadas. 3. Complete o modifique los datos de: Soporte tecnico y Telefono de Soporte Tecnico. 4. Haga clic en el boton [Actualizar],
45699,"¿Cómo activar y colocar seña para controlar cliente que tiene cuenta vencida y colocar días de Gracia? (activación de seña, configuración de días de gracia, gestión de cuentas vencidas)","1 - Ingrese en el menú {Utilidades/Configuraciones . 2 - Vaya a la pestaña [Presupuesto.16]. 3 - Haga click en la opción [ ] Avisa cuando cliente tiene cuenta vencida. 4 - Al lado, en días de Gracia [ ], coloque la cantidad de días que no serán controlados luego de vencer la cuenta. 5 - Para colocar la seña, haga click en el botón [Seña para máximo descuento], e inserte una seña que habilite un descuento mayor al permitido y presione en el teclado ENTER.",
44514,"¿Cómo implementar control de vencimiento de cuentas (gestionar, administrar, controlar, manejar)?","1 - Ingrese en el menú {Utilidades/ Configuraciones/ Aviso de que el cliente tiene cuenta vencida. 6 - Inserte la seña que desea, presione ENTER y vuelva a repertir la seña y presione ENTER una vez más. 6 - Haga click en el botón [Actualizar].",
46410,"¿Cómo restringir/permitir venta al cliente si tiene cuenta vencida (bloquear, permitir, autorizar, denegar)?",1 - Ingrese en el menú {Utiilidades/ Configuraciones/,
46485,"¿Cómo tener varios precios distintos (diferentes, variados, múltiples, varios)?","1 - En la ficha del Registro del Artículo defina un precio establecido (Precio General o a vista). 2 - Luego vaya al menú {Tablas/ Registrar Canal }. 3 - Presione la tecla F12 o haga clik en el botón [ + ]. 4 - Coloque el nombre que desea para el canal en el campo [Descripción]. Ej: Precio a Crédito. 5 - En el campo Porcentaje Mínimo y Máximo, coloque el porcentaje que desea de descuento o aumento. 6 - En el campo de [Tipo de Cálculo], coloque V, si el porcentaje aplicado será sobre el precio de Venta establecido o C, si el porcentaje aplicado será sobre el precio Costo. 7 - De esa manera puede crear varios precios para cada artículo dependiendo del porcentaje aplicado en cada Canal. 8 - Cuando seleccione un canal en la venta y luego elige el artículo, el precio traerá automáticamente con el precio calculado por el porcentaje aplicado.",
46504,"¿Cómo configurar para visualizar / ver la foto / imagen del artículo en la venta (mostrar, visualizar, ver, mostrar)?","1 - Ingrese en el menú {Utiilidades/ Configuraciones/ Pestaña Venta 2.07}. 2 - Haga click en la opción: En venta por Escritorio visualiza FOTO de artículo, o haga click en su respectiva casilla [ ] para habilitar la opción.",
46505,"¿Cómo configurar para visualizar / ver la foto del artículo en Presupuesto (mostrar, visualizar, ver, mostrar)?",No se proporcionan pasos en el texto.,
46484,"¿Cómo guardar / agregar / colocar una foto / imagen en el artículo (agregar, guardar, colocar, subir)?","1 - Ingrese en el menú {Tablas/ Registrar Artículo}. 2 - En el apartado de agregar imagen, puede hacer click en el botón [+] para agregar una imagen guardada en el computador. 3 - Si tiene una WebCam, puede quitar la foto en ese mismo instante haciendo click en el botón [Sacar foto], luego en el botón [Tomar Foto] y por último [Salir], con ello quedará automáticamente guardada la foto.",
46506,"¿Cómo configurar para ver / visualizar imagen / foto en el buscador de artículo (visualizar, mostrar, ver, imagen, foto, artículo, buscador)?","1 - Ingrese en el menú {Utilidades/ Configuraciones/ Pestaña Presupuesto.16}. 2 - Haga click en la opcion: En venta Registrar Pestaña [Venta 2.07)}. 3 - En el campo de: Días para Bloqueo, coloque cuántos días después de haber vencido debe de bloquear la venta al cliente. 4 - Al lado, en el botón de [Seña para permitir ventas a clientes con cuentas], haga click e ingrese la seña para bloquear la venta al cliente y presione ENTER, repita la seña y vuelva a presionar ENTER. 5 - En el campo de: Solo Aviso, ingrese la cantidad de días después de haber vencido la cuenta para dar un aviso. Link de Video en Youtube: https://www.youtube.com/watch?v=QD28K75TyLM&feature=youtu.be",
46507,"¿Cómo generar códigos de artículo y visualizar la imagen correspondiente en el buscador (generar, códigos, artículo, imagen, buscador)?","1 - Ingrese en el menú {Utilidades/ Configuraciones/ Pestaña Artículo.02}. 2 - Vaya hasta el apartado de: Método de Visualización de Ventana de Artículos. 3 - Coloque el Número 2 en el campo, que corresponde al Tipo 2 - Compuesto. 4 - Con ello al buscar el artículo en la venta o en consulta de Artículo, podrá visualizar la imagen correspondiente en el buscador.",
46587,"¿Cómo evitar que se modifique o elimine el interés de una cobranza con una seña (evitar, modificar, eliminar, interés, cobranza, seña)?",1 - Ingrese en {Utilidades/ Configuraciones/ Pestaña Cobranza.10}. 2 - Haga click en el botón [Seña para Mod. Interes Cob]. 3 - Ingrese la seña que desea colocar y presione ENTER. 4 - Repita la seña y presione nuevamente ENTER.,
46584,"¿Cómo colocar mensaje urgente para un cliente (colocar, mensaje, urgente, cliente)?","1- Ingrese en {Tablas/ Registrar Cliente}. 2- Introduce el nombre del cliente en el campo de busqueda y luego presione el botón [traer]. 3- Presione sobre ""Mensaje Urgente para cliente"" y luego introduzca en dicho campo el mensaje que quiere que aparezca cuando se realiza movimientos para el cliente. 4- Presione el botón [Guardar]",
46622,"¿Cómo generar cierta cantidad artículos de una vez y cargarlos rápidamente (generar, artículos, cantidad, rápidamente)?","1 - Ingrese en {Tablas/ Modificar Dato de Artículo}. 2 - Haga click en el botón [ [+]Art. ]. 3 - En el campo [Desde],",
46623,"¿Cómo desactivar un cliente para la venta (desactivar, cliente, venta)?","1- Ingrese en {Tablas/ Registrar Cliente}. 2- Introduce el nombre del cliente en el campo de busqueda y luego presionar el botón [traer]. 3- Marque la opción ""Desactivado para Venta"". 4- Presione el botón [Guardar]",
46628,"Agregar imagenes de los datos de un cliente (subir, cargar, insertar, adjuntar)","1- Ingrese en {Tablas/ Registrar Cliente}, 2-Introduce el nombre del cliente en el campo de busqueda y luego presione el botón [traer], 3- Presione el botón [Foto] que se encuentra en la parte inferior del formulario, 4- Presione el botón [Agregar Imagen], 5- Seleccione la imagen que desea insertar, una vez insertada todas las imagenes, presione el botón [salir], 6- Presione el botón [Guardar]",
46629,"Actualizar los datos de informconf de un cliente (actualizar, modificar, cambiar)","1- Ingrese en {Tablas/ Registrar Cliente}, 2-Introduce el nombre del cliente en el campo de busqueda y luego presione el botón [traer], 3- Presione el botón [Actualizar inforcom] que se encuentra en la parte inferior del formulario, 4- Ingrese todos los datos de inforcom del cliente y presione el botón [Confirmar], 5- Luego presione el botón [Guardar]",
46657,"Colocar nombre para factura legal de un cliente (asignar, establecer, configurar)","1- Ingrese en {Tablas/ Registrar Cliente}, 2- Ingrese a la Pestaña {Cliente.05} y marque la opción ""Verifica que nombre no está vacío"", 3- Presione el botón [Actualizar]",
46631,"Configurar para que no registre un cliente con el campo de telefono vacío (configurar, establecer, validar)","1- Ingrese a {Utilidades/ Configuraciones}, 2- Ingrese a la Pestaña {Cliente.05} y marque la opción ""Verifica que telefono no está vacío"", 3- Presione el botón [Actualizar]",
46658,"Configurar para que no registre un cliente con el campo de telefono vacío (configurar, establecer, validar)","1- Ingrese a {Utilidades/ Configuraciones}, 2- Ingrese a la Pestaña {Cliente.05} y marque la opción ""Verifica que telefono no está vacío"", 3- Presione el botón [Actualizar]",
46632,"Agregar descuentos fijos en ventas para un cliente (descuentos, promociones, ofertas, rebajas)","1- Ingrese en {Tablas/ Registrar Cliente} 2- Introduce el nombre del cliente en el campo de busqueda y luego presione el botón [traer] 3- Ingrese a la Pestaña {Comercial} y coloque el monto del descuento en el campo ""Monto para descuento en Venta"" 4- Presione el botón [Guardar]",
46659,"Verificar numero de cedula igual a 0 (verificar, comprobar, validar, verificar cedula)","1- Ingrese a {Utilidades/ Configuraciones} 2- Ingrese a la Pestaña {Cliente.05} y marque la opción ""Verifica que C.I no sea 0"" 3- Presione el botón [Actualizar]",
46633,"Configurar para que me avise si se quiere registrar un cliente con numero de cedula igual al de otro (avisar, notificar, alertar, verificar cedula existente)","1- Ingrese a {Utilidades/ Configuraciones} 2- Ingrese a la Pestaña {Cliente.05} y marque la opción ""Verifica en alta de cliente C.I existente"" 3- Presione el botón [Actualizar]",
46660,"Configurar para que no me permita registrar un cliente con codigo similar al de otro (validar, verificar, comprobar, codigo similar)","1- Ingrese a {Utilidades/ Configuraciones} 2- Ingrese a la Pestaña {Cliente.05} y marque la opción ""Controla códigos paronimos"" 3- Presione el botón [Actualizar]",
46661,"Configurar para que me aparezca la fecha de cumpleaños de mis clientes al ingresar al sistema (cumpleaños, fecha de nacimiento, aniversario)","1 - Para ello debe de colocar la fecha de Nacimiento en el registro del Cliente, Ingrese en el menú {Tablas/ Registrar Cliente} 2 - Si el cliente ya está registrado, Ingrese el nombre del cliente en el campo [Buscar], y presione ENTER, luego haga click en el botón [Traer] 3 - Si el cliente aun no está registrado, presione la tecla F12 o haga click en el botón [ + ] para crearlo y complete los datos necesarios 4 - Luego en el campo [Fec. Nacim], coloque la fecha de Nacimiento del cliente y haga click en el botón [Guardar] 5 - Luego, vuelva al menú principal y vaya al menú {Utilidades/ Configuraciones/ Pestaña [Cliente.05] } 6 - Haga click en la casilla [ ] de la opción: Visualiza cumpleaños de cliente al inciar el Sistema 7 - En Rango de días de Cumpleaños, coloque [ 1 ] hasta [ 31 ], o un rango de días que desee que muestre los cumpleaños de los clientes 8 - Haga click en el botón [Actualizar]",
46662,"Configurar para que me avise si se quiere registrar un cliente con R.U.C igual al de otro cliente (R.U.C, registro unico, verificar R.U.C)","1- Ingrese a {Utilidades/ Configuraciones} 2- Ingrese a la Pestaña {Cliente.05} y marque la opción ""Verifica si R.U.C de cliente ya existe"" 3- Presione el botón [Actualizar]",
46656,"Permitir solo venta contado o crédito a un cliente (venta contado, venta crédito, planes de venta)","1 - Para ello se debe tener 2 Planes, uno configurado para permitir solo venta Contado y otro que permita solo venta a Crédito 2 - Ingrese en {Tablas/ Registrar Plan} 3 - Busque el plan contado en el campo naranjado de arriba ingresando el nombre del Plan y presione ENTER luego haga click en el botón [Traer], si aun no existe el plan contado, cree uno nuevo",
46673,"¿Como configurar la búsqueda de clientes? (buscar, encontrar, localizar, ubicar)","1- Ingrese en {Utilidades/ Configuraciones/ Pestaña[Búsquedas.04] }. 2- En el apartado CLIENTE, en Campos para búsquedas de cliente. 3- Escriba los siguientes parámetros: allt(cli_nombre)+"" ""+allt(cli_ruc)+"" ""+allt(cli_telefo). 4- Haga click en el botón [Actualizar]. Link: https://youtu.be/bJ6xQiQYx_M",
46722,"¿ Como obtener informe de venta por Condición (Ej. Venta contado/ Crédito/ Crédito 8 días/ 15 días)? (informe, reporte, resumen, estadísticas)","1. Ingrese en la opción {Movimientos/ Informe de Venta}. 2. Complete en el filtro fecha el periodo del cual desea extraer el informe (Ej. 01/03/2020 al 30/03/2020). 3. Haga click en el botón [Procesar]. 4. En ""Ventas Agrupadas por"" haga click en el boton [Condición]",
46671,"¿Como relacionar un canal con un cliente? (asociar, vincular, conectar, enlazar)","1 - Ingrese en {Tablas/ Registrar Cliente}. 2 - Busque el cliente en el campo naranjado de arriba ingresando el nombre del Cliente y presione ENTER. 3 - Luego haga click en la Pestaña [Comercial], y en el campo [Canal Venta], ingrese el Canal que desea establecer por defecto al cliente a la hora de la venta.",
46845,"¿ Como saber en que Sucursal se realizó más ventas dentro de un rango de fecha? (saber, conocer, informar, analizar)","1. Ingrese en la opción {Movimientos/ Informe de Venta}. 2. Complete en el filtro fecha el periodo del cual desea extraer el informe (Ej. 01/03/2020 al 30/03/2020). 3. Haga click en el botón [Procesar]. 4. En ""Ventas Agrupadas por"" haga click en el boton [Sucursal]",
46672,"¿Cómo controlar el cambio de nombre del Cliente con una contraseña? (gestionar, administrar, cambiar, modificar)","1. Ingrese en la opción {Movimientos/ Informe de Venta} 2. Complete en el filtro fecha el periodo del cual desea extraer el informe (Ej. 01/03/2020 al 30/03/2020) 3. Haga click en el botón [Procesar] 4. En ""Ventas Agrupadas por"" haga click en el boton [Sucursal]",
46846,"¿Cómo saber que vendedor vendió más en una fecha determinada? (conocer, identificar, determinar, encontrar)","1 - Ingrese en {Utilidades/ Configuraciones/ Pestaña [Cliente.05]} 2 - Haga click en el botón [Seña para modificar nombre de Cliente]. 3 - Ingrese la seña que desee y presione ENTER. 4 - Repita la seña para confirmar y presione ENTER. 5 - Si desea cambiar el nombre a partir de ahora, vaya",
46852,"¿Cómo quitar un informe de venta de la cantidad vendida de artículos agrupado por Proveedor? (eliminar, suprimir, quitar, borrar)","1. Ingrese en la opción {Movimientos/ Informe de Venta} 2. Complete en el filtro fecha el periodo del cual desea extraer el informe de las ventas. 3 - Haga click en el botón [Procesar]. 4 - En el apartado ""Ventas Agrupadas por:"" haga click en el boton [Articulo].",
46847,"¿Cómo saber que marca de artículos se vendieron más en un mes? (conocer, identificar, determinar, encontrar)","1 - Ingrese en la menú {Movimientos/ Informe de Venta detallado por artículo}. 2 - Complete en el filtro de fecha el periodo del cual desea extraer el informe. (Ej. 01/04/2020 al 30/04/2020) 3 - Haga click en el botón [Procesar]. 4 - En el apartado ""Ventas Agrupadas por:"" haga click en el boton [Marca].",
46848,"¿Cómo quitar un informe de venta de cantidad vendida de artículos por mes? (eliminar, suprimir, quitar, borrar)","1. Ingrese en la opción {Movimientos/ Informe de Venta detallado por articulo} 2. Complete en el filtro fecha el periodo del cual desea extraer el informe (Ej. 01/03/2020 al 30/03/2020) 3. Haga click en el botón [Procesar] 4. En ""Ventas Agrupadas por"" haga click en el boton [Articulo/Mes].",
46853,"¿Cómo obtener informe de cobranza detallado en EXCEL? (generar, crear, obtener, descargar)","1. Ingrese en la opción {Administrativa/ Gestion de Cobranza/ Informe de Cobranza} 2. Complete en el filtro fecha el periodo del cual desea extraer el informe (Ej. 01/03/2020 al 30/03/2020) 3. Haga click en el botón [Procesar] 4. En ""Excel"" haga click en el boton [Detallado].",
46876,"¿Cómo implementar control de fecha de vencimiento de cheque? (configurar, establecer, implementar, controlar)",1 - Ingrese en el menú {Utilidades/ Configuraciones/ Pestaña Cheque},
46851,"Quitar informe de venta de la cantidad vendida de artículos por Agrupación (eliminar, borrar, cancelar, anular)","1 - Ingrese en el menú {Movimientos/ Informe de Venta detallado por artículo}. 2 - Complete en el filtro de fecha el periodo del cual desea extraer el informe. 3 - Haga click en el botón [Procesar]. 4 - En el apartado ""Ventas Agrupadas por:"" haga click en el boton [Agrupacion].",
47016,"Quitar informe de venta de la cantidad vendida de artículos con porcentaje (eliminar, borrar, cancelar, anular)",1 - Ingrese en el menú {Movimientos/ Informe de Venta detallado por artículo}. 2 - Complete en el filtro de fecha el periodo del cual desea extraer el informe.,
47447,"Obtener informe de stock de artículo por deposito (informe de stock, stock de artículo, inventario)","1. Ingrese en la opción {Informes/ Informe de Articulos}. 2. Coloque el deposito que desee en el filtro ""Deposito"". 3. Luego elija la opción [Informe de Posición de Stock]",
48528,"Extraer informe de todos los gastos que tuve en un periodo (gastos, egresos, informe de gastos)","1- Ingrese en {Procesos/ Gestion de Caja/ Informe de caja}. 2- Coloqué el periodo del cual quiere sacar el informe y en el filtro de grupo de rubro coloque ""Egresos"". 3- Presione el botón [Procesar]. 4- Seleccione la opción [Informe detallado por rubro]",
47743,"Crear cuentas pendientes de forma manual para los clientes (cuentas pendientes, crear cuentas, cuentas manuales)",1 - Ingrese desde el menú a {Movimientos/ Mantenimiento de cuenta}. 2 - Haga click en el botón [Nuevo]. 3 - Ingrese el Plan y el cliente correspondiente y haga click,
48976,"Evitar que salga Continua--> en la impresión del presupuesto (presupuesto, impresión, configuración)","1. Ingrese a {Utilidades/ Configuraciones/ Pestaña Presupuesto.16}. 2. En la opción ""Cantidad maxima de item en presu"" coloque 30.",
