ID,Pregunta_Hibrida,Respuesta,Video
70282,"Como relacionar un cajero con la caja (relación, cajero, caja)","1. Ingrese a {Tablas/ Cobranza y Cajas/ Registrar Cajero}, 2. Presione sobre el botón [Seña para eliminar Cheques], Link: https://youtu.be/YsZjZ8tBJA0",
71056,"Como establecer seña para Anular/ Eliminar cheque (seña, anulación, eliminación, cheque)","1. Ingrese a {Utilidades/ Configuraciones/ Cheques}, 2. Coloque el codigo del cajero, presione [Enter], Link: https://youtu.be/5uNfsxS-ljs",
70461,"Como relacionar un usuario con su cajero (relación, usuario, cajero)","1. Ingrese a {Tablas/ Registrar Usuario}, 2. Coloque el codigo del usuario, presione [Enter], Link: https://youtu.be/clG04imUOuA",
71087,"Como actualizar stock en la web para el pleom (actualización, stock, web, pleom)","1. Ingrese al menu {Utilidades > Gestion Web (pleom)}, 2. En la columna de {Pleom} seleccione el boton de Stock, Link: https://youtu.be/HjzpmsR2tH8",
71616,"Configuración de cliente (configuración, cliente)","1. Ingrese a {Utilidades/ Configuraciones/ Movimiento}, 2. Marque la opción ""Utiliza operación por usuario en Movimiento"", Link: https://youtu.be/d8_43yQe6ZA",
75178,"Como colocar seña para ver costo en consulta de todos los movimientos del código actual (consultar, verificar, revisar, buscar)","1. Ingrese a {Utilidades/ Configuraciones/ Pd. Venta 14} 2. Seleccione el botón [Seña para ver Costo en Consulta de Articulo] 3. Coloque la seña, presione Enter y vuelva a repetir la seña, presione Enter 4. Presione el botón [Actualizar] 5. Presione el botón [Confirmar] 6. Presione [Si] en los dos mensaje que le muestra. 7. Una vez terminado el procedimiento, presione [Aceptar]",
71958,"Error: "" no se encuentra el ejecutable del WinSCP"" al subir imagen al PLEOM (error, problema, fallo)","1. Se debe copiar el archivo Winscp.zip que se encuentra en la dirercción D:\jraiz\jsoft 2. Se pega el archivo copiado en el servidor del cliente, en el disco local c. 3. Se descomprime el archivo. Ya debe funcionar correctamente luego de este procedimiento",
75438,"Como puedo configurar para que al anular una venta se anule el presupuesto que está relacionado (configurar, establecer, definir)","1. Ingrese a {Utilidades/ Configuraciones/ Venta 2.1} 2. Marque la opción ""Al Anular venta, anular también el presupuesto"" 3. Presione [Actualizar]",
72561,"¿Como activar la configuración para visualizar imagenes de artículos en la venta (activar, habilitar, configurar)","1 - Ingrese al menú {Utilidades/ Configuraciones/ Pestaña *[Venta 2.1.07]* } 2 - En el apartado ""Configuraciones 1"", marque la opción: *En venta por Escritorio Visualiza FOTO de Artículo [ ]*",
76050,"Para realizar correctamente una copia de seguridad a través de jCobian (realizar, hacer, ejecutar)","1 - Ingrese al menú {Utilidades/ Configuraciones/ Pestaña *[Venta 2.1.07]* } 2 - En el apartado ""Configuraciones 1"", marque la opción: *En venta por Escritorio Visualiza FOTO de Artículo [ ]*",
73226,"Obtener listado de todos los proveedores del sistema (obtener, conseguir, listar)",1. Ingrese en {Informes\ Catalogos\ Catalogos de tablas} 2. Seleccione la opción [Proveedor],
76167,"Descomponer un articulo de tipo kit en venta por escritorio (descomponer, dividir, separar)","Link: https://youtu.be/XeR_AFPzmDE Verifique si la carpeta de origen no tiene signos inapropiados (espacios, barras, puntos demás)",
73308,"jSuceso: Al intentar grabar una imagen, se traba el sistema (solucionar, arreglar, reparar)","Verifique si la carpeta de origen no tiene signos inapropiados (espacios, barras, puntos demás)",
76243,"¿Como imprimir extracto de cliente en ticket (imprimir, generar, crear)",1. Ingrese a Movimiento/ Extracto de Cliente 2. Filtre por el cliente y el rango de fecha. 3. Presione el botón [Procesar] 4. Presione la opción [Extracto en ticket],
74797,"Estoy en una venta y deseo hacerle un descuento en el total de la venta (descuento, rebaja, reducción)",1 - Ingresar en la ventana venta 2 Ingresar los articulos 3- Confirmar la venta 4 - En la parte izquierda de la ventana confirmar venta se encontrara el cuadro de Descuento en total de la venta 5- Registrar su descuento y guardar.,
76614,"Cambiar código del cliente (modificar, actualizar, cambiar)",Presione el botón [Cambiar código del cliente],
76910,"Gestion de Agendamiento / Modulo de Citas Registrar Debe/Haber de Funcionario (gestionar, administrar, controlar)","Link: Pago adicional en liquidación de salario, Debe Haber https://www.youtube.com/watch?v=UNP5aMj250w",
78545,"Quitar la sucursal predeterminada en compras (eliminar, borrar, suprimir)","1 - Ingrese al menu {Utilidades/ Configuraciones}. 2 - En ""Valores Predeterminado para Compra"", en el campo ""Codigo para sucursal"", borre el dato que está dentro del campo (dejar vacío). 3 - Seleccione la opción de [procesar]. 4 - Haga clic en el botón [Actualizar]",
77076,"Sacar un informe de inventario (generar, crear, obtener)","1 - Ingrese a la pestaña {Compra.03}. 2 - Ingrese a {Informes/ Informe de artículos}. 3 - Defina el rango de fecha en el que desea sacar el informe. 4 - Luego de procesar, en la opción {Valorizados} seleccione el botón [Detallado]",
78694,"Desinstalar actualización de Windows (desinstalar, eliminar, quitar)",https://youtu.be/VUtLkxA18qc,
77709,"Hacer una Venta a clientes especiales con contraseña (realizar, efectuar, llevar a cabo)",https://youtu.be/eBmPYzoZusw,
78955,"Modificar multiplos de cantidad por unidad de medida (modificar, cambiar, actualizar)",https://youtu.be/VUtLkxA18qc,
77712,"Quitar informe de los socios activos de este año (eliminar, borrar, suprimir)","1 - Ingrese a {Movimientos/ Informe de venta detallado por articulo}. 2 - Coloque en el rango de fecha el periodo para obtener el informe. 3 - Luego identifique en el filtro de agrupaciones la agrupación ""Cuota social"". 4 - Haga clic en el boton [Procesar]. 5 - En la seccion de botones ""Detallado por"" haga clic en el boton [Detallado x clientes Agrupado x articulo]",
78965,"Solución de Error de ¨Se infringe la unicidad del indice xxx¨ (solucionar, resolver, arreglar)","1 - Ingrese a {Movimientos/ Informe de venta detallado por articulo}. 2 - Coloque en el rango de fecha el periodo para obtener el informe. 3 - Luego identifique en el filtro de agrupaciones la agrupación ""Cuota social"". 4 - Haga clic en el boton [Procesar]. 5 - En la seccion de botones ""Detallado por"" haga clic en el boton [Detallado x clientes Agrupado x articulo]",
77759,"Obtener Informe del Libro Iva (obtener, generar, crear)",https://youtu.be/trveBTVWxxw,
79049,"Eliminar deuda de proveedor (eliminar, borrar, suprimir)",1 - Ingrese al menu { Compras}. 2 - Haga clic en el botón [Mantenimiento de Deuda]. 3 - Busque y Seleccione la Deuda a ser eliminada. 4 - Presione el botón [Eliminar]. 5 - Presione el botón [Sí],
79112,"Implementar caja por moneda (implementar, configurar, establecer)",https://youtu.be/FUHUxOx7Mx0,
79113,"Implementación de cobranza y caja en dólares y guaraníes (implementar, configurar, establecer)",https://youtu.be/FUHUxOx7Mx0,
78135,"Quitar informe de los socios al día (eliminar, borrar, suprimir)",1 - Ingrese a {Movimientos/ Informe de venta detallado por articulo},
79535,"Obtener informe de notas de crédito generadas en un periodo de fecha (informe, notas, crédito, fecha)","1. Ingrese en el menu: {Informes\ Catalogos\ Catalogos de clientes} 2. En el filtro de fecha de alta, complete en la parte de arriba la fecha desde el cual desea ver si hay clientes nuevos, en el filtro de abajo puede dejar con la fecha del día 3. Presione el boton [Procesar].",
79165,"Actualizar datos en la web para el pleom (actualizar, datos, web, pleom)",1. Ingrese al menu {Utilidades / Gestion Web (jpleom) } 2. En la columna de {Pleom} seleccione el botón del cual desea actualizar los datos 3. presione el botón enviar,
79552,"Quitar informe de nuevos socios (quitar, informe, nuevos, socios)","1. Ingrese en el menu: {Informes\ Catalogos\ Catalogos de clientes} 2. En el filtro de fecha de alta, complete en la parte de arriba la fecha desde el cual desea ver si hay clientes nuevos, en el filtro de abajo puede dejar con la fecha del día 3. Presione el boton [Procesar].",
79647,"Obtener un informe de notas de crédito generadas en un periodo de fecha (informe, notas, crédito, fecha)",1. Ingrese a {Movimientos/ Nota de Crédito/ Informe de Nota de Crédito} 2. En el filtro de fecha coloque la fecha de inicio y fin del cual desea obtener el informe 3. Seleccione el botón [Procesar] 4. Seleccione la opción [Informe detallado] o [Informe agrupado por cliente],
79166,"Implementar Factura Legal (implementar, factura, legal)",1- Ingrese en {Utilidades/ Configuraciones/ Pestaña Venta2.2.07 } 2- Marque las siguientes opciones: Descuentos por agrupacion - No permite modificar venta con impresion. -Controla la duplicacion nro de factura en venta. - No permite guardar venta sin nro de establecimiento y p. expedicion.,
79167,"Asignar descuentos especiales (asignar, descuentos, especiales)",1- Ingrese en {Utilidades/ Configuraciones/ Pestaña Venta2.2.07 } 2- Marque las siguientes opciones: Descuentos por agrupacion - No permite modificar venta con impresion. -Controla la duplicacion nro de factura en venta. - No permite guardar venta sin nro de establecimiento y p. expedicion. https://youtu.be/LlfEe93GPi8,
79457,"Gestión transpaso a histórico Procedimientos especiales (gestión, transpaso, histórico, procedimientos)",https://youtu.be/jePI0fE3IkE,
79881,"Obtener un informe de venta que incluya las notas de créditos generadas por devoluciones (informe, venta, notas, créditos)","1. Ingrese en la opción {Movimientos/ Informe de Venta} 2. Coloque el rango de fecha del cual desea sacar el informe Ej :[01/01/2021 al 25/10/2021] 3. Seleccione la opción ""Incluye devoluciones""",
80433,"server (servidor, equipo, máquina)","Haga clic en [ Procesar ], Puede seleccionar cualquiera de los botones. Ej: https://www.youtube.com/watch?v=4IOLv51rXgo, [Informe de ventas], [I.V.A Ventas]",
81037,"Como Activar office con KMSAuto NET (activar, habilitar, configurar)","Desactivar Antivirus, Cerrar office, Abrir 'KMSAuto Net' y seleccionar la opcion de, Seleccionar [Activar office], Volver a Activar el Antivirus",
80505,"¿Como hacer presupuesto para JHF? (presupuesto, plan, estimación)","Obtener un informe de las ventas que son mayores a #tags: Informe, presupuesto, registrar, 1.000.000 gs en un rango de fecha? https://www.youtube.com/watch?v=Nh4FslRLymo",
81411,"¿Como hacer presupuesto para JHF? (presupuesto, plan, estimación)","Obtener un informe de las ventas que son mayores a #tags: Informe, presupuesto, registrar, 1.000.000 gs en un rango de fecha? https://www.youtube.com/watch?v=Nh4FslRLymo",
80900,"Al ingresar en el Gestion de cita me aparece un error (error, problema, falla)","Ingrese en la opción {Movimientos/ Informe de Venta}, Complete en el filtro fecha el periodo del cual desea, Copie el MSCAL.OCX en la carpeta C:\Windows\SysWOW644, Ejecute el programa CMD como administrador y coloque lo siguiente: regsvr32 c:\windows\syswow64\mscal.ocx",
82222,"¿Como obtener informe de los articulos que no se vendieron en un rango de fecha y tienen stock? (informe, reporte, lista)","Ingrese en la opción {Movimientos/ Informe de Venta detallado por Artículo}, Complete el filtro de fecha con el rango que desee, Presione el botón [Procesar], Presione la tecla [cfg] que se encuentra al lado del botón [Articulo no vendido], En la opción: ""Visualiza [1] Solo articulos c/stock actual, [2] Todos los acrticulos"", coloque el valor de",
84108,"Como hacer liquidacion de aguinaldo? (liquidación, cálculo, pago)",PDF: https://drive.google.com/file/d/1iEtqFVmNor1rnI7g7hTk2IuOOzLM-UW/view?usp=sharing,
81002,"Que hacer para Des-Anular Factura (desanular, revertir, cancelar)","En vista de las variedades de opciones que habia y la generacion de movimiento de caja, decidimos utilizar la opcion de {REPLICAR} donde se puede ubicar sobre una venta anulada y {Replicar para levantar} una nueva venta",
87025,"¿Como solucionar el problema de tabla dañada? (solucionar, reparar, corregir)","1 - Sobre el acceso directo del Sistema, haga clic derecho y seleccione [Abrir la ubicación del Archivo], 2- Dentro de la Carpeta, busque una aplicación con el nombre",
87041,"¿Cómo visualizar Saldo y Diferencia al realizar Cierre (visualizar, saldo, diferencia, cierre, realizar)","1. Marque solo la opción "" 1. Corrije Cabecera (Se ha de caja? dañado datos)"", 2. Presione el botón [Procesar].",
89098,"¿Cómo sacar informe de PDF (informe, pdf, obtener, informes)","1) Ingrese en el Menu: {Utilidades/Configuraciones/Movimiento 2.37}, 2) Haga click en la opción de ‘[ ]Visualiza saldo y diferencia de caja’, 3) Haga click en el boton [Actualizar]",
89099,"¿Cómo registrar una devolución (devolución, registro, devoluciones)","GUIA - Como registrar una devolución, Tags: Devolucion, registro",
87119,"¿Cómo instalar fuentes de código de barra (instalar, fuentes, código, barra)","1. Descargue la fuente ""3of9"" del siguiente link: https://www.dafont.com/es/search.php?q=3of9, 2. Descomprima el archivo, luego copie el archivo ""3of9_new"", 3. En la barra de inicio coloque para buscar la palabra ""Fuentes"", seleccione la opción ""Configuración de fuentes"" o ""Fuentes"", 4. Posicionese en cualquier parte de la pantalla principal y luego pegue la fuente.",
89100,"¿Cómo recuperar una factura anulada (recuperar, factura, anulada, recuperación)","GUIA - ¿Cómo recuperar una factura anulada?, https://jhf.com.py/v6/guias/Recuperar-una-Factura-anulada.pdf",
89101,"¿Cómo registrar y pagar aguinaldo (registrar, pagar, aguinaldo, registro)","GUIA - Registro y Pago de Aguinaldo, https://jhf.com.py/v6/guias/Registro-y-Pago-de-Aguinaldo.pdf",
87189,"¿Qué hacer si no se puede ingresar en la grilla de cantidad (ingresar, grilla, cantidad, bloqueado)","GUIA - ¿Como agendar una cita?, 1- Ingrese en {Utilidades/ Configuraciones/ Pestaña Venta3 }, 2- Tamaño en grilla, 3- Buscar Cantidad y aumentar a mayor de 60.",
89102,"¿Cómo agendar una cita (agendar, cita, agenda)","GUIA - ¿Como agendar una cita?, https://jhf.com.py/v6/guias/spa_peluqueria-Como-Agendar-una-Cita.pdf",
89103,"¿Cómo registrar movimiento de servicio (registrar, movimiento, servicio, registro)","GUIA - ¿Como Registrar Movimiento de Servicio?, https://jhf.com.py/v6/guias/spa_peluqueria-Como-Registrar-Movimiento-de-Servicio.pdf",
87361,"¿Cómo sacar informe de servicios filtrando por funcionario (informe, servicios, filtrar, funcionario)","GUIA - Como sacar informe de Servicios filtrando por funcionario, https://jhf.com.py/v6/guias/INFORME_DE_SERVICIOS.pdf",
89104,"¿Cómo registrar nuevos servicios (registrar, nuevos, servicios, registro)","GUIA - Como registrar nuevos servicios, https://jhf.com.py/v6/guias/spa_peluqueria-como-registrar-nuevos-servicios.pdf",
88008,"¿Cómo solucionar error de ""Se infringe unicidad del indice"" (solucionar, error, unicidad, indice)","Solución con Jauxi, https://youtu.be/HhRHUjoG0gI, https://youtu.be/eED03WNJDCc",
89504,"¿Cómo actualizar WebService (actualizar, WebService, actualización)","Solución con Jauxi, https://youtu.be/HhRHUjoG0gI, https://youtu.be/eED03WNJDCc",
88210,"¿Cómo colocar/modificar/quitar seña para eliminar movimiento de caja (colocar, modificar, quitar, seña, eliminar, movimiento, caja)","1. Ingrese a {Utilidades/ Configuraciones/ Pestaña Venta3 }, 2. Tamaño en grilla, 3. Buscar Cantidad y aumentar a mayor de 60.",
90397,"Colocar Licencia Defi (instalar, configurar, habilitar)","Presione el botón [Seña para eliminar movimiento] istrarUnaVentaPorMostrador.pdf, Coloque la nueva seña, presione enter, luego vuelva a colocar la seña y presione enter nuevamente, Presione el botón [Actualizar]",
93382,"Reparar data dañada con jAuxi (reparar, restaurar, recuperar)","Como reparar data dañada con jAuxi, https://youtu.be/gu1TfhtGU1Y",
93383,"Eliminar articulos por rango de movimiento (eliminar, borrar, suprimir)","Eliminar articulos por rango de movimiento, https://youtu.be/mZ3mwqivDX0",
90678,"Registrar Pago de Energía Eléctrica (registrar, pagar, abonar)","Como registrar Pago de Energía Eléctrica, https://youtu.be/mZ3mwqivDX0, Implementacion Factura Legal: https://jhf.com.py/v6/guias/Como_registrar_Pago_de_Energia_Electrica.pdf",
93676,"Implementar Factura Legal (implementar, configurar, habilitar)",Implementacion Factura Legal: https://jhf.com.py/v6/guias/Como_registrar_Pago_de_Energia_Electrica.pdf,
90679,"Registrar cotizacion de monedas (registrar, cotizar, cambiar)","Como registrar cotizacion de monedas, https://youtu.be/6HAwY9U8bSY",
93965,"Desactivar uso de rendimiento pdf (desactivar, inhabilitar, deshabilitar)","Como desactivar uso de rendimiento pdf, https://jhf.com.py/v6/guias/DesactivarUsoRendimiento.pdf",
91281,"Informe de Posición de Stock (informe, posición, stock)","Informe de Posición de Stock, https://jhf.com.py/v6/guias/Informe_de_presicion_de_st.pdf",
93966,"Resolver problema de impresión (resolver, solucionar, reparar)","Resolver problema de impresión, https://jhf.com.py/v6/guias/Informe_de_presicion_de_st.pdf",
91997,"Cambiar la resolución de pantalla en el servidor (cambiar, modificar, ajustar)","Como cambiar la resolución de pantalla en el servidor, https://youtu.be/1ylkBnpuM0U",
94032,"Cambiar código de vendedor (cambiar, modificar, actualizar)","GUIA - Como cambiar codigo de vendedor, https://jhf.com.py/v6/guias/Como-cambiar-codigo-de-vendedor.pdf",
94033,"Devolución articulo sin generar nota de crédito (devolver, regresar, restituir)","Devolución articulo sin generar nota de crédito, https://youtu.be/8O-v6Ti1vRc",
92445,"Obtener un Informe de Posición de Stock (obtener, sacar, informe)","Como obtener un Informe de Posición de Stock, https://youtu.be/3gsDzCZ9uCw",
92658,"Registro de Ítems de Ítems de servicio (registrar, agregar, crear)","Registro de Ítems de Ítems de servicio, https://jhf.com.py/v6/guias/Informe_de_Posicion_de_Stock.pdf",
94289,"Registrar Articulos (registrar, agregar, crear)","Como Registrar Articulos, https://jhf.com.py/v6/guias/Super_despensa_ComoRegistarArticulos.pdf",
93380,"Pasar un informe a PDF (pasar, convertir, transformar)","Como pasar un informe a PDF, https://jhf.com.py/v6/guias/Como_pasar_un_informe_a_PDF.pdf",
94290,"Registrar una compra (registrar, agregar, crear)","Como Registrar una compra, https://jhf.com.py/v6/guias/Super_despensa_ComoRegistarUnaCompra.pdf",
93381,"Obtener Informe Valorizado de stock (obtener, sacar, informe)","Como obtener Informe Valorizado de stock, https://jhf.com.py/v6/guias/Informe_de_Valorizado_de_stock.pdf",
94291,"Registrar una Venta por Mostrador (registrar, agregar, crear)","Como Registrar una Venta por Mostrador, https://jhf.com.py/v6/guias/Super_despensa_ComoRegistarUnaVentaPorMostrador.pdf",
95766,"Crear / modificar / eliminar un vendedor (agregar, eliminar, actualizar, registrar)","1. Ingrese en {Tablas/ Venta/ Registrar Vendedor}, 2. Presione el botón [+] o la tecla f12 del teclado para asignar un código automático, 3. Complete con los datos del vendedor, 4. Presione el botón [Guardar]",
95849,"Obtener un informe de los cheques que están por vencer (informe, cheques, vencer, fecha)","1. Ingrese a {Procesos/ Gestión de Cheques/ Informe de Cheques}, 2. En el campo de fecha de vencimiento coloque la fecha desde y hasta del cual desea que le muestre todos los cheques, 3. Presione el botón [Procesar], 4. Seleccione cualquiera de los informes que desee",
96036,"Agregar seña para rubro (seña, rubro, agregar, contraseña)",https://youtu.be/b31HWtcKdc4,
94534,"Crear diferentes planes y uso (planes, uso, crear, diferentes)",https://youtu.be/kWkk_x_OMUo,
98169,"Realizar Analiza y Corrige Stock (analizar, corregir, stock, inconsistente)","https://youtu.be/kWkk_x_OMUo, https://jhf.com.py/v6/guias/Analiza_yCorrigeStock.pdf",
94728,"Modificar el salario del funcionario (salario, funcionario, modificar, cambiar)",https://jhf.com.py/v6/guias/Como-Modificar-el-Salario-del-Funcionario.pdf,
98831,"Asignar contraseña para modificar limite de crédito (contraseña, crédito, asignar, modificar)",https://jhf.com.py/v6/guias/Como_asignar_contraseña_para_modificar_limite_de_crédito.pdf,
94729,"Crear, formular y usar servicios (servicios, crear, formular, usar)",https://youtu.be/OAZHLZJrIZg,
99064,"Realizar transferencia de configuraciones de un vendedor a otro (transferencia, configuraciones, vendedor, otro)",https://youtu.be/qegcqpdrdcA,
94943,"Canjear los puntos de los clientes (puntos, clientes, canjear, intercambiar)","https://youtu.be/qegcqpdrdcA, https://jhf.com.py/v6/guias/Como_canjear_los_puntos_de_los_clientes.pdf",
99395,"Gestion de Timbrado para la set (timbrado, set, gestion, establecimiento)",https://youtu.be/BieAshNxKbQ,
95561,"Activar el canjeo de Puntos de los clientes (canjeo, puntos, clientes, activar)","https://youtu.be/BieAshNxKbQ, https://jhf.com.py/v6/guias/Como_activar_el_canjeo_de_puntos_de_los_clientes.pdf",
99396,"Asignar contraseña para modificar limite de crédito (contraseña, crédito, asignar, modificar)",https://jhf.com.py/v6/guias/Como_asignar_contraseña_para_modificar_limite_de_crédito.pdf,
95765,"Activar y desactivar red ethernet (red, ethernet, activar, desactivar)",https://youtu.be/bQSZLa6jZp4,
99492,"Informe de venta filtrado por numero de establecimiento y punto de expedición (informe, venta, establecimiento, expedición)",,
94295,"Remarcar (remarcar, remarcar, remarcar, remarcar)",https://youtu.be/SIYf-Bk5cGw,
99664,"¿Cómo extraer informe de rendimiento del sistema? (informe de rendimiento, reporte del sistema, estadísticas del sistema)","1. Ingrese a {Utilidades/ Informe de rendimiento} 2. Filtre por el rango de fecha que desee extraer el informe. Ej: 01/09/2022 al 15/09/2022 3. Seleccione el tipo de informe ""1. De rendimiento"" 4. Presione el botón [Procesar] 5. Seleccione el modelo de impresión ""Impresión Detallada"" o ""Promedio por origen""",
99667,"Como anular venta con liquidación a vendedores (anular venta, cancelar venta, eliminar factura, echar para atras)","1. Ingrese a {Utilidades/ Informe de rendimiento} 2. Filtre por el rango de fecha que desee extraer el informe. Ej: 01/09/2022 al 15/09/2022 3. Seleccione el tipo de informe ""1. De rendimiento"" 4. Presione el botón [Procesar] 5. Seleccione el modelo de impresión ""Impresión Detallada"" o ""Promedio por origen""",
101504,"Como realizar Informe de Venta detallado por articulo y filtrado por Cliente (informe de venta, reporte de venta, estadísticas de venta)",https://jhf.com.py/v6/guias/InformedeVentadetalladoporarticulofiltradoporCliente.pdf,
100085,"Como desactivar funcionario (deshabilitar funcionario, inactivar funcionario, inhabilitar funcionario)",https://jhf.com.py/v6/guias/Como_Desactivar_Funcionario.pdf,
101542,"Como modificar el nombre de la empresa (cambiar nombre de la empresa, configurar nombre de la empresa, nick de la empresa, nombre de la organización)",https://jhf.com.py/v6/guias/Comomodificarelnombredelaempresa.pdf,
100086,"¿Como obtener Informe de Ganancia por Agrupacion? (informe de ganancia, reporte de ganancia, estadísticas de ganancia)",1. Ingrese en la opción {Informes/Informe de Ganancia} 2. En los filtros coloque el rango de fecha deseado y luego haga clic en [Procesar] 3. Una vez consultado elija el botón [Resumido por Agrupacion],
100087,"Como imprimir seña en código de barra (imprimir seña, código de barra, contrasenha, contraseña, sacar seña)",https://jhf.com.py/v6/guias/Comoimprimirseñacodigoodebarra.pdf,
102201,"Como realizar informe de cuentas filtrado por cliente (informe de cuentas, reporte de cuentas, estadísticas de cuentas)",https://jhf.com.py/v6/guias/Como_realizar_informe_de_cuentas_filtrado_por_cliente.pdf,
100088,"Como recuperar una compra que no fue procesada (recuperar compra, restaurar compra, retornar compra, comisión)",https://youtu.be/e-GxBdZ2asA,
102860,"Como Forzar borrado de cliente (borrar cliente, eliminar cliente, delet cliente, movimiento cliente)","1. Ingrese en {Tablas/ Registrar cliente} 2. Coloque el código ""8585"" y en la descripción del cliente coloque ""Cliente borrado forzado"" 3. Presione el botón [Guardar] 4. Ingrese en la opcion {Utilidades/ Configuraciones} 5. En la pestaña [Cliente.05] en la opción 'Codigo para forzar borrado de cliente' coloqué el codigo ""8585""",
100555,"Devolución de articulo desde entrada de articulo (devolución de articulo, registrar devolución, timbrado, nota, configuración)",https://youtu.be/NYlKflrqqBE,
100696,"Obtener Informe RG90 (informe RG90, conseguir informe RG90, impresion informe RG90, comprobantes, exportar, contador, set, hacienda)",https://youtu.be/CYm4YOc-FEs,
100807,"Como sacar Informe de Compra (informe de compra, obtener informe de compra, recibir informe de compra, imprimir informe de compra, listado de compras)",https://youtu.be/CYm4YOc-FEs,
100879,"Borrar Cliente (eliminar, cancelar, suprimir, anular)","Debe activar el check: [Forzar borrado de Cliente con movimiento]. Presione el botón [Actualizar]. Luego vaya a {Tablas/ Registrar cliente}, busque el cliente que desea borrar en el buscador, presione traer y seleccione el botón [borrar]",
104445,"Actualizar Número de Timbrado (renovar, configurar, actualizar)",Obs: Todos los movimientos registrados anteriormente por el cliente a ser borrado pasaran a pertenecer al código de cliente especificado en configuraciones. https://jhf.com.py/v6/guias/Como_Actualizar_Numero_de_Timbrado.pdf,
111352,"Gestion de puntos y canjes (configuración, utilización, canje, método, valor)",https://youtu.be/L3KHVZPclR4,
